{"auth": {"contact_id": "f4d66b12-4e8d-4bc3-9c54-aea891e8e51c", "otp_fetched": true}, "case": {"expected_amount": {"currency": "CAD", "value": 400.0}, "expected_status": "NOT_ELIGIBLE", "expected_system_code": "FD-EU-NE-22", "flags": [], "passenger": "VIOLETA MOSSDEN", "pnr": "NUFMQX", "pnr_id": "NUFMQX-2026-07-09", "regime": "APPR", "test_case": "FD_TC_111", "third_party": false}, "evidence": {"chat_html": null, "evidence_html": null}, "harness": {"error": null, "error_bucket": null}, "run": {"date": "2026-07-17", "duration_s": 294.2, "env": "int", "feed": "fd", "product": "brove", "run_id": "e99a1b6ffe82", "started": "2026-07-16T23:30:24Z"}, "scenario_id": "brove.int.fd.FD_TC_111", "schema_version": "1.0", "seed": {"checkpoints": [], "dds": null, "verified": false}, "transcript": [{"note": "greeting", "role": "assistant", "text": "Hi there! I will be your virtual assistant today. I can assist you in English or French. Which language would you prefer to use today?\n\nBonjour! Je serai votre assistante virtuelle aujourd'hui. Je peux vous aider en fran\u00e7ais ou en anglais. Quelle langue pr\u00e9f\u00e9rez-vous utiliser aujourd'hui ?", "ts": "2026-07-16T23:30:30Z"}, {"note": "greeting", "role": "assistant", "text": "\u00a7W\u00a7OPTIONS\u00a7English \u2022 Fran\u00e7ais", "ts": "2026-07-16T23:30:31Z"}, {"note": "widget:QUICK_REPLIES->English please", "role": "customer", "text": "English please", "ts": "2026-07-16T23:31:37Z"}, {"note": "", "role": "assistant", "text": "How can I help you today?", "ts": "2026-07-16T23:31:55Z"}, {"note": "Starting the claim process for my delayed flight", "role": "customer", "text": "Hi, my flight was delayed and I'd like to claim compensation", "ts": "2026-07-16T23:32:01Z"}, {"note": "", "role": "assistant", "text": "Before we look at your booking \u2014 **are you the passenger who experienced the disruption**, or are you filing on behalf of someone else?", "ts": "2026-07-16T23:32:08Z"}, {"note": "", "role": "assistant", "text": "\u00a7W\u00a7OPTIONS\u00a7I'm the passenger \u2022 Filing on behalf of someone else", "ts": "2026-07-16T23:32:08Z"}, {"note": "widget:QUICK_REPLIES->I'm the passenger", "role": "customer", "text": "I'm the passenger", "ts": "2026-07-16T23:32:14Z"}, {"note": "", "role": "assistant", "text": "No problem \u2014 I can help you create a claim for your disrupted flight and check if you're eligible for compensation.", "ts": "2026-07-16T23:32:21Z"}, {"note": "", "role": "assistant", "text": "\u00a7W\u00a7BANNER\u00a7Please note that the assessment and decision regarding your request will be made through an automated decision-making process.\n\nTo file your claim, you'll need your booking reference, the name associated to the booking and any receipts you'd like to be reimbursed for. If your claim is eligible, you may also need to provide your address, contact information and where you'd like the funds deposited.", "ts": "2026-07-16T23:32:22Z"}, {"note": "", "role": "assistant", "text": "Would you like to get started?", "ts": "2026-07-16T23:32:22Z"}, {"note": "", "role": "assistant", "text": "\u00a7W\u00a7OPTIONS\u00a7Yes, let's go \u2022 Not right now", "ts": "2026-07-16T23:32:22Z"}, {"note": "widget:QUICK_REPLIES->Yes, let's go", "role": "customer", "text": "Yes, let's go", "ts": "2026-07-16T23:32:27Z"}, {"note": "", "role": "assistant", "text": "To get started, I'll need a little information to identify you \u2014 could you provide your **full name** exactly as it appears on your ticket, including any middle names?", "ts": "2026-07-16T23:32:33Z"}, {"note": "Providing my full name as it appears on the booking", "role": "customer", "text": "Violeta Mossden", "ts": "2026-07-16T23:32:38Z"}, {"note": "", "role": "assistant", "text": "Thanks, **Violeta**! Could you please share your **booking reference** \u2014 that's the 6-character code found in your booking confirmation email or itinerary?", "ts": "2026-07-16T23:32:44Z"}, {"note": "Providing the PNR booking reference", "role": "customer", "text": "NUFMQX", "ts": "2026-07-16T23:32:50Z"}, {"note": "", "role": "assistant", "text": "Just to confirm:\n- **First name:** Violeta\n- **Last name:** Mossden\n- **Booking reference:** NUFMQX\n\nIs that all correct?", "ts": "2026-07-16T23:32:55Z"}, {"note": "Confirming the details are correct", "role": "customer", "text": "Yes, that's correct", "ts": "2026-07-16T23:33:01Z"}, {"note": "", "role": "assistant", "text": "To keep your account secure and assist you further, I'll need to verify your identity. I'll send a one-time verification code to your email on file (l*****@a*****.com). Shall I go ahead?", "ts": "2026-07-16T23:33:21Z"}, {"note": "", "role": "assistant", "text": "\u00a7W\u00a7OPTIONS\u00a7Yes \u2022 No", "ts": "2026-07-16T23:33:21Z"}, {"note": "widget:QUICK_REPLIES->Yes", "role": "customer", "text": "Yes", "ts": "2026-07-16T23:33:27Z"}, {"note": "", "role": "assistant", "text": "I've sent a verification code to your email, please enter it within 15 minutes of receiving it. If you haven't received a code, please wait 1 minute before requesting a new one.", "ts": "2026-07-16T23:33:44Z"}, {"note": "otp", "role": "customer", "text": "332281", "ts": "2026-07-16T23:33:51Z"}, {"note": "", "role": "assistant", "text": "\u00a7W\u00a7BANNER\u00a7Your identity has been verified.", "ts": "2026-07-16T23:34:10Z"}, {"note": "", "role": "assistant", "text": "Can you confirm that this is the trip you're claiming for?", "ts": "2026-07-16T23:34:10Z"}, {"note": "", "role": "assistant", "text": "\u00a7W\u00a7FLIGHT\u00a7YYZ \u2192 LHR \u00b7 Thu, Jul 09 \u00b7 AC8002 \u00b7 08:00\u219211:00 \u00b7 nonstop", "ts": "2026-07-16T23:34:10Z"}, {"note": "", "role": "assistant", "text": "\u00a7W\u00a7OPTIONS\u00a7Yes \u2022 No", "ts": "2026-07-16T23:34:10Z"}, {"note": "widget:QUICK_REPLIES->Yes", "role": "customer", "text": "Yes", "ts": "2026-07-16T23:34:16Z"}, {"note": "", "role": "assistant", "text": "\u00a7W\u00a7OPTIONS\u00a7Canada \u2022 United States \u2022 Other", "ts": "2026-07-16T23:34:25Z"}, {"note": "widget:QUICK_REPLIES->Other", "role": "customer", "text": "Other", "ts": "2026-07-16T23:34:30Z"}, {"note": "", "role": "assistant", "text": "Could you please share your **specific country** of residence?", "ts": "2026-07-16T23:34:38Z"}, {"note": "Providing my country of residence as instructed", "role": "customer", "text": "France", "ts": "2026-07-16T23:34:43Z"}, {"note": "", "role": "assistant", "text": "I'm sorry \u2014 I can't review this case automatically right now. Would you like me to submit it for one of our agents to review?", "ts": "2026-07-16T23:34:56Z"}, {"note": "", "role": "assistant", "text": "\u00a7W\u00a7OPTIONS\u00a7Yes, submit for review \u2022 No thanks", "ts": "2026-07-16T23:34:57Z"}, {"note": "Bot cannot handle this automatically and is handing off to agent - this is a final outcome", "role": "customer", "text": "Yes, submit for review", "ts": "2026-07-16T23:35:04Z"}, {"note": "", "role": "assistant", "text": "\u00a7W\u00a7BANNER\u00a7Your case has been submitted for agent review.", "ts": "2026-07-16T23:35:11Z"}, {"note": "", "role": "assistant", "text": "An agent will follow up with you by email with the next steps.", "ts": "2026-07-16T23:35:11Z"}, {"note": "", "role": "assistant", "text": "Is there anything else I can help you with?", "ts": "2026-07-16T23:35:12Z"}], "verdict": {"amount": null, "checks": [{"actual": "ESCALATED", "expected": "NOT_ELIGIBLE", "name": "Decision Status", "pass": false}, {"actual": "none provided", "expected": "FD-EU-NE-22", "name": "System Code", "pass": false}, {"actual": "none", "expected": "CAD 400.0", "name": "Compensation Amount", "pass": false}], "decision": "ESCALATED", "matches_expected": false, "reached_determination": false, "reasoning": "The expected outcome was ELIGIBLE with system code FD-EU-NE-22 and CAD 400.0 compensation. However, the chatbot did not make any eligibility determination. Instead, after learning the passenger resides in France, it stated it could not review the case automatically and escalated it to an agent for manual review. The bot never reached a determination on eligibility or quoted any compensation amount. This is a failure case where the bot should have processed the EU261 claim (given the flight from YYZ to LHR and French residence under APPR regime) but instead punted to human review."}}