{
  "auth": {
    "contact_id": "8199ce1a-8379-4ad2-ad06-5c0ec8f4f8ce",
    "otp_fetched": true
  },
  "case": {
    "expected_amount": null,
    "expected_status": "NOT_ELIGIBLE",
    "expected_system_code": "FD-EU-NE-07",
    "flags": [],
    "passenger": "CORMAC WESTENRA",
    "pnr": "QFQEQK",
    "pnr_id": "QFQEQK-2026-07-10",
    "regime": "APPR",
    "test_case": "FD_TC_099",
    "third_party": false
  },
  "evidence": {
    "chat_html": null,
    "evidence_html": null
  },
  "harness": {
    "error": null,
    "error_bucket": null
  },
  "run": {
    "date": "2026-07-17",
    "duration_s": 309.4,
    "env": "int",
    "feed": "fd",
    "product": "bravo",
    "run_id": "137425e5349b",
    "started": "2026-07-17T14:45:12Z"
  },
  "scenario_id": "bravo.int.fd.FD_TC_099",
  "schema_version": "1.0",
  "seed": {
    "checkpoints": [],
    "dds": null,
    "verified": false
  },
  "transcript": [
    {
      "note": "greeting",
      "role": "assistant",
      "text": "Hi there! I will be your virtual assistant today. I can assist you in English or French. Which language would you prefer to use today?\n\nBonjour! Je serai votre assistante virtuelle aujourd'hui. Je peux vous aider en fran\u00e7ais ou en anglais. Quelle langue pr\u00e9f\u00e9rez-vous utiliser aujourd'hui ?",
      "ts": "2026-07-17T14:45:18Z"
    },
    {
      "note": "greeting",
      "role": "assistant",
      "text": "\u00a7W\u00a7OPTIONS\u00a7English \u2022 Fran\u00e7ais",
      "ts": "2026-07-17T14:45:19Z"
    },
    {
      "note": "widget:QUICK_REPLIES->English please",
      "role": "customer",
      "text": "English please",
      "ts": "2026-07-17T14:46:25Z"
    },
    {
      "note": "",
      "role": "assistant",
      "text": "How can I help you today?",
      "ts": "2026-07-17T14:46:41Z"
    },
    {
      "note": "Starting the claim process for my delayed flight",
      "role": "customer",
      "text": "Hi, I had a flight delay and I'd like to claim compensation",
      "ts": "2026-07-17T14:46:49Z"
    },
    {
      "note": "",
      "role": "assistant",
      "text": "Before we look at your booking \u2014 **are you the passenger who experienced the disruption**, or are you filing on behalf of someone else?",
      "ts": "2026-07-17T14:46:58Z"
    },
    {
      "note": "",
      "role": "assistant",
      "text": "\u00a7W\u00a7OPTIONS\u00a7I'm the passenger \u2022 Filing on behalf of someone else",
      "ts": "2026-07-17T14:46:59Z"
    },
    {
      "note": "widget:QUICK_REPLIES->I'm the passenger",
      "role": "customer",
      "text": "I'm the passenger",
      "ts": "2026-07-17T14:47:05Z"
    },
    {
      "note": "",
      "role": "assistant",
      "text": "No problem \u2014 I can help you create a claim for your disrupted flight and check if you're eligible for compensation.",
      "ts": "2026-07-17T14:47:15Z"
    },
    {
      "note": "",
      "role": "assistant",
      "text": "\u00a7W\u00a7BANNER\u00a7Please note that the assessment and decision regarding your request will be made through an automated decision-making process.\n\nTo file your claim, you'll need your booking reference, the name associated to the booking and any receipts you'd like to be reimbursed for. If your claim is eligible, you may also need to provide your address, contact information and where you'd like the funds deposited.",
      "ts": "2026-07-17T14:47:15Z"
    },
    {
      "note": "",
      "role": "assistant",
      "text": "Would you like to get started?",
      "ts": "2026-07-17T14:47:15Z"
    },
    {
      "note": "",
      "role": "assistant",
      "text": "\u00a7W\u00a7OPTIONS\u00a7Yes, let's go \u2022 Not right now",
      "ts": "2026-07-17T14:47:16Z"
    },
    {
      "note": "widget:QUICK_REPLIES->Yes, let's go",
      "role": "customer",
      "text": "Yes, let's go",
      "ts": "2026-07-17T14:47:21Z"
    },
    {
      "note": "",
      "role": "assistant",
      "text": "To get started, I'll need a little info to identify you. Could you provide your **full name exactly as it appears on your ticket**, including any middle names?",
      "ts": "2026-07-17T14:47:28Z"
    },
    {
      "note": "Providing my full name as it appears on the booking",
      "role": "customer",
      "text": "Cormac Westenra",
      "ts": "2026-07-17T14:47:33Z"
    },
    {
      "note": "",
      "role": "assistant",
      "text": "Thanks, **Cormac**! Could you please share your **booking reference number**?",
      "ts": "2026-07-17T14:47:42Z"
    },
    {
      "note": "Providing my PNR booking reference",
      "role": "customer",
      "text": "QFQEQK",
      "ts": "2026-07-17T14:47:48Z"
    },
    {
      "note": "",
      "role": "assistant",
      "text": "Just to confirm:\n\n- **First name:** Cormac\n- **Last name:** Westenra\n- **Booking reference:** QFQEQK\n\nIs that all correct?",
      "ts": "2026-07-17T14:47:53Z"
    },
    {
      "note": "Confirming the details are correct",
      "role": "customer",
      "text": "Yes, that's correct",
      "ts": "2026-07-17T14:47:59Z"
    },
    {
      "note": "",
      "role": "assistant",
      "text": "To keep your account secure and assist you further, I'll need to verify your identity. I'll send a one-time verification code to your email on file (l*****@a*****.com). Shall I go ahead?",
      "ts": "2026-07-17T14:48:13Z"
    },
    {
      "note": "",
      "role": "assistant",
      "text": "\u00a7W\u00a7OPTIONS\u00a7Yes \u2022 No",
      "ts": "2026-07-17T14:48:13Z"
    },
    {
      "note": "widget:QUICK_REPLIES->Yes",
      "role": "customer",
      "text": "Yes",
      "ts": "2026-07-17T14:48:19Z"
    },
    {
      "note": "",
      "role": "assistant",
      "text": "I've sent a verification code to your email, please enter it within 15 minutes of receiving it. If you haven't received a code, please wait 1 minute before requesting a new one.",
      "ts": "2026-07-17T14:48:28Z"
    },
    {
      "note": "otp",
      "role": "customer",
      "text": "922240",
      "ts": "2026-07-17T14:48:34Z"
    },
    {
      "note": "",
      "role": "assistant",
      "text": "\u00a7W\u00a7BANNER\u00a7Your identity has been verified.",
      "ts": "2026-07-17T14:48:54Z"
    },
    {
      "note": "",
      "role": "assistant",
      "text": "Can you confirm that this is the trip you're claiming for?",
      "ts": "2026-07-17T14:48:54Z"
    },
    {
      "note": "",
      "role": "assistant",
      "text": "\u00a7W\u00a7FLIGHT\u00a7YYZ \u2192 YYZ \u00b7 Fri, Jul 10 \u00b7 AC8002 \u00b7 08:00\u219211:00 \u00b7 nonstop",
      "ts": "2026-07-17T14:48:54Z"
    },
    {
      "note": "",
      "role": "assistant",
      "text": "\u00a7W\u00a7OPTIONS\u00a7Yes \u2022 No",
      "ts": "2026-07-17T14:48:55Z"
    },
    {
      "note": "widget:QUICK_REPLIES->Yes",
      "role": "customer",
      "text": "Yes",
      "ts": "2026-07-17T14:49:01Z"
    },
    {
      "note": "",
      "role": "assistant",
      "text": "\u00a7W\u00a7OPTIONS\u00a7Canada \u2022 United States \u2022 Other",
      "ts": "2026-07-17T14:49:28Z"
    },
    {
      "note": "widget:QUICK_REPLIES->Other",
      "role": "customer",
      "text": "Other",
      "ts": "2026-07-17T14:49:33Z"
    },
    {
      "note": "",
      "role": "assistant",
      "text": "Could you please specify your **country of residence**?",
      "ts": "2026-07-17T14:49:50Z"
    },
    {
      "note": "Providing my country of residence as instructed",
      "role": "customer",
      "text": "France",
      "ts": "2026-07-17T14:49:56Z"
    },
    {
      "note": "",
      "role": "assistant",
      "text": "I've reviewed the details of your flight. I understand your flight on **Jul 15, 2026** was delayed by **4h**. However, you're not eligible for compensation for this flight. After a full review, the reason is: Your flight was disrupted by circumstances outside the carrier's control.\n\nWe sincerely apologize for the inconvenience and appreciate your understanding.",
      "ts": "2026-07-17T14:50:06Z"
    },
    {
      "note": "",
      "role": "assistant",
      "text": "Is there anything else I can help you with?",
      "ts": "2026-07-17T14:50:06Z"
    },
    {
      "note": "Assistant has provided a final determination - not eligible due to circumstances outside carrier's control. Accepting the decision politely as instructed.",
      "role": "customer",
      "text": "I understand. Thank you for checking.",
      "ts": "2026-07-17T14:50:13Z"
    },
    {
      "note": "",
      "role": "assistant",
      "text": "\u00a7W\u00a7INFO\u00a7FEEDBACK",
      "ts": "2026-07-17T14:50:15Z"
    }
  ],
  "verdict": {
    "amount": null,
    "checks": [
      {
        "actual": "NOT_ELIGIBLE",
        "expected": "NOT_ELIGIBLE",
        "name": "Decision Status",
        "pass": true
      },
      {
        "actual": "none",
        "expected": "n/a",
        "name": "Compensation Amount",
        "pass": true
      },
      {
        "actual": "Not explicitly stated, but reason aligns with extraordinary circumstances",
        "expected": "FD-EU-NE-07",
        "name": "System Code",
        "pass": true
      }
    ],
    "decision": "NOT_ELIGIBLE",
    "matches_expected": true,
    "reached_determination": true,
    "reasoning": "The chatbot successfully completed the claim assessment and reached a final determination. The outcome was NOT_ELIGIBLE with no compensation offered, which matches the expected verdict exactly. The bot cited that the flight was disrupted by circumstances outside the carrier's control, which aligns with the expected system code FD-EU-NE-07 (extraordinary circumstances under EU regulations). The passenger (Cormac Westenra) with PNR QFQEQK under APPR regime was correctly assessed as not eligible for compensation."
  }
}