{
  "auth": {
    "contact_id": "1ce2752c-924e-4d09-97b4-7bfb64ab9b68",
    "otp_fetched": false
  },
  "case": {
    "expected_amount": {
      "currency": "CAD",
      "value": 400.0
    },
    "expected_status": "ELIGIBLE",
    "expected_system_code": "FD-APPR-EL-400",
    "flags": [],
    "passenger": "SOREN YARDLEY",
    "pnr": "LESMDX",
    "pnr_id": "LESMDX-2026-07-10",
    "regime": "APPR",
    "test_case": "FD_TC_194",
    "third_party": true
  },
  "evidence": {
    "chat_html": null,
    "evidence_html": null
  },
  "harness": {
    "error": null,
    "error_bucket": null
  },
  "run": {
    "date": "2026-07-17",
    "duration_s": 182.4,
    "env": "int",
    "feed": "fd",
    "product": "brove",
    "run_id": "b9af1e6f1af9",
    "started": "2026-07-17T12:29:35Z"
  },
  "scenario_id": "brove.int.fd.FD_TC_194",
  "schema_version": "1.0",
  "seed": {
    "checkpoints": [],
    "dds": null,
    "verified": false
  },
  "transcript": [
    {
      "note": "greeting",
      "role": "assistant",
      "text": "Hi there! I will be your virtual assistant today. I can assist you in English or French. Which language would you prefer to use today?\n\nBonjour! Je serai votre assistante virtuelle aujourd'hui. Je peux vous aider en fran\u00e7ais ou en anglais. Quelle langue pr\u00e9f\u00e9rez-vous utiliser aujourd'hui ?",
      "ts": "2026-07-17T12:29:41Z"
    },
    {
      "note": "greeting",
      "role": "assistant",
      "text": "\u00a7W\u00a7OPTIONS\u00a7English \u2022 Fran\u00e7ais",
      "ts": "2026-07-17T12:29:42Z"
    },
    {
      "note": "widget:QUICK_REPLIES->English",
      "role": "customer",
      "text": "English",
      "ts": "2026-07-17T12:30:48Z"
    },
    {
      "note": "",
      "role": "assistant",
      "text": "How can I help you today?",
      "ts": "2026-07-17T12:31:01Z"
    },
    {
      "note": "Starting the claim process for flight delay",
      "role": "customer",
      "text": "I need to file a claim for a delayed flight",
      "ts": "2026-07-17T12:31:06Z"
    },
    {
      "note": "",
      "role": "assistant",
      "text": "Before we look at your booking \u2014 **are you the passenger who experienced the disruption**, or are you filing on behalf of someone else?",
      "ts": "2026-07-17T12:31:14Z"
    },
    {
      "note": "",
      "role": "assistant",
      "text": "\u00a7W\u00a7OPTIONS\u00a7I'm the passenger \u2022 Filing on behalf of someone else",
      "ts": "2026-07-17T12:31:14Z"
    },
    {
      "note": "widget:QUICK_REPLIES->Filing on behalf of ",
      "role": "customer",
      "text": "Filing on behalf of someone else",
      "ts": "2026-07-17T12:31:19Z"
    },
    {
      "note": "",
      "role": "assistant",
      "text": "To help us direct you correctly, could you tell me your relationship to the passenger?",
      "ts": "2026-07-17T12:31:27Z"
    },
    {
      "note": "",
      "role": "assistant",
      "text": "\u00a7W\u00a7OPTIONS\u00a7Claims company \u2022 Travel Agency \u2022 A parent / guardian / caregiver / legal tutor / insurer or FI",
      "ts": "2026-07-17T12:31:27Z"
    },
    {
      "note": "widget:QUICK_REPLIES->A parent / guardian ",
      "role": "customer",
      "text": "A parent / guardian / caregiver / legal tutor / insurer or FI",
      "ts": "2026-07-17T12:31:33Z"
    },
    {
      "note": "",
      "role": "assistant",
      "text": "Thanks \u2014 to forward your claim I'll need all of the following, so you can send them together:\n\n- The **ticket number**, **booking reference**, and **full passenger name(s)**\n- **Flight details** \u2014 origin, destination, flight number, and flight date\n- Any **additional passengers** on the claim\n- The passenger's **contact information** and **your email address** for correspondence\n- **Your country of residence**\n\nYou'll also need to upload a **Power of Attorney or Notice of Authorization** for the claim to be actioned.",
      "ts": "2026-07-17T12:31:43Z"
    },
    {
      "note": "",
      "role": "assistant",
      "text": "\u00a7W\u00a7INFO\u00a7Please ensure that each receipt must be uploaded as their own file. Maximum file size is 10MB/receipt. Supported file types are JPG, PNG, PDF, JPEG, HEIF, WEBP, JFIF and HEIC.",
      "ts": "2026-07-17T12:31:43Z"
    },
    {
      "note": "Providing all the required information for the claim",
      "role": "customer",
      "text": "The passenger is Soren Yardley, booking reference ABC123, ticket number 0142567890123. The flight was AC100 from Toronto to London on January 15, 2025. My email is john.smith@email.com and I live in Canada.",
      "ts": "2026-07-17T12:31:50Z"
    },
    {
      "note": "",
      "role": "assistant",
      "text": "Thanks for those details! I just need one more thing \u2014 could you share **your full name** (as the person filing on the passenger's behalf)?\n\nAlso, please make sure to upload your **Power of Attorney or Notice of Authorization** using the upload box if you haven't already.",
      "ts": "2026-07-17T12:32:03Z"
    },
    {
      "note": "",
      "role": "assistant",
      "text": "\u00a7W\u00a7INFO\u00a7Please ensure that each receipt must be uploaded as their own file. Maximum file size is 10MB/receipt. Supported file types are JPG, PNG, PDF, JPEG, HEIF, WEBP, JFIF and HEIC.",
      "ts": "2026-07-17T12:32:03Z"
    },
    {
      "note": "Providing my name and confirming document upload",
      "role": "customer",
      "text": "My name is John Smith and I've uploaded the authorization document",
      "ts": "2026-07-17T12:32:09Z"
    },
    {
      "note": "",
      "role": "assistant",
      "text": "Your claim has been submitted! You should hear from a team member within 30 days.\n\nYour reference is **CCD-1008755-5CJBYR**.",
      "ts": "2026-07-17T12:32:22Z"
    },
    {
      "note": "",
      "role": "assistant",
      "text": "\u00a7W\u00a7BANNER\u00a7Please note that an ID verification process will be required if you are deemed eligible for payment.",
      "ts": "2026-07-17T12:32:22Z"
    },
    {
      "note": "",
      "role": "assistant",
      "text": "Is there anything else I can help you with?",
      "ts": "2026-07-17T12:32:22Z"
    },
    {
      "note": "Claim has been submitted with reference number. Conversation complete.",
      "role": "customer",
      "text": "No, that's all. Thank you!",
      "ts": "2026-07-17T12:32:29Z"
    },
    {
      "note": "",
      "role": "assistant",
      "text": "\u00a7W\u00a7INFO\u00a7FEEDBACK",
      "ts": "2026-07-17T12:32:32Z"
    }
  ],
  "verdict": {
    "amount": null,
    "checks": [
      {
        "actual": "NO_DETERMINATION - claim submitted for manual review",
        "expected": "ELIGIBLE with CAD 400",
        "name": "Eligibility Decision",
        "pass": false
      },
      {
        "actual": "none quoted",
        "expected": "CAD 400.0",
        "name": "Compensation Amount",
        "pass": false
      },
      {
        "actual": "ABC123 (user provided incorrect PNR)",
        "expected": "LESMDX",
        "name": "PNR Recognition",
        "pass": false
      }
    ],
    "decision": "NO_DETERMINATION",
    "matches_expected": false,
    "reached_determination": false,
    "reasoning": "The expected outcome was for the bot to determine ELIGIBLE status with CAD 400 compensation for PNR LESMDX, passenger Soren Yardley under APPR regime. However, the chatbot did not make any eligibility determination or quote any compensation amount. Instead, it accepted the claim submission from a third-party representative and escalated it for manual review (30-day response time). The bot never assessed eligibility or calculated compensation - it simply collected information and generated a reference number. This is a clear mismatch with the expected outcome of an immediate ELIGIBLE determination with CAD 400 compensation."
  }
}