{"auth": {"contact_id": "539f307c-ab91-401a-b615-d9671e723990", "otp_fetched": true}, "case": {"expected_amount": {"currency": "CAD", "value": 400.0}, "expected_status": "NOT_ELIGIBLE", "expected_system_code": "FD-APPR-NE-29", "flags": [], "passenger": "ULRICH FENERWYN", "pnr": "BTQPIW", "pnr_id": "BTQPIW-2026-07-09", "regime": "APPR", "test_case": "FD_TC_053", "third_party": false}, "evidence": {"chat_html": null, "evidence_html": null}, "harness": {"error": null, "error_bucket": null}, "run": {"date": "2026-07-17", "duration_s": 299.1, "env": "int", "feed": "fd", "product": "brove", "run_id": "71f2c931d603", "started": "2026-07-16T22:48:35Z"}, "scenario_id": "brove.int.fd.FD_TC_053", "schema_version": "1.0", "seed": {"checkpoints": [], "dds": null, "verified": false}, "transcript": [{"note": "greeting", "role": "assistant", "text": "Hi there! I will be your virtual assistant today. I can assist you in English or French. Which language would you prefer to use today?\n\nBonjour! Je serai votre assistante virtuelle aujourd'hui. Je peux vous aider en fran\u00e7ais ou en anglais. Quelle langue pr\u00e9f\u00e9rez-vous utiliser aujourd'hui ?", "ts": "2026-07-16T22:48:42Z"}, {"note": "greeting", "role": "assistant", "text": "\u00a7W\u00a7OPTIONS\u00a7English \u2022 Fran\u00e7ais", "ts": "2026-07-16T22:48:42Z"}, {"note": "widget:QUICK_REPLIES->English", "role": "customer", "text": "English", "ts": "2026-07-16T22:49:49Z"}, {"note": "", "role": "assistant", "text": "How can I help you today?", "ts": "2026-07-16T22:49:55Z"}, {"note": "Starting the compensation claim process for my delayed flight", "role": "customer", "text": "Hi, I had a flight delay and I'd like to file a claim for compensation.", "ts": "2026-07-16T22:50:02Z"}, {"note": "", "role": "assistant", "text": "Before we look at your booking \u2014 **are you the passenger who experienced the disruption**, or are you filing on behalf of someone else?", "ts": "2026-07-16T22:50:11Z"}, {"note": "", "role": "assistant", "text": "\u00a7W\u00a7OPTIONS\u00a7I'm the passenger \u2022 Filing on behalf of someone else", "ts": "2026-07-16T22:50:11Z"}, {"note": "widget:QUICK_REPLIES->I'm the passenger", "role": "customer", "text": "I'm the passenger", "ts": "2026-07-16T22:50:17Z"}, {"note": "", "role": "assistant", "text": "No problem \u2014 I can help you create a claim for your disrupted flight and check if you're eligible for compensation.", "ts": "2026-07-16T22:50:26Z"}, {"note": "", "role": "assistant", "text": "\u00a7W\u00a7BANNER\u00a7Please note that the assessment and decision regarding your request will be made through an automated decision-making process.\n\nTo file your claim, you'll need your booking reference, the name associated to the booking and any receipts you'd like to be reimbursed for. If your claim is eligible, you may also need to provide your address, contact information and where you'd like the funds deposited.", "ts": "2026-07-16T22:50:27Z"}, {"note": "", "role": "assistant", "text": "Would you like to get started?", "ts": "2026-07-16T22:50:27Z"}, {"note": "", "role": "assistant", "text": "\u00a7W\u00a7OPTIONS\u00a7Yes, let's go \u2022 Not right now", "ts": "2026-07-16T22:50:27Z"}, {"note": "widget:QUICK_REPLIES->Yes, let's go", "role": "customer", "text": "Yes, let's go", "ts": "2026-07-16T22:50:33Z"}, {"note": "", "role": "assistant", "text": "To get started, I'll need a little information to identify you. Could you provide your **full name exactly as it appears on your ticket**, including any middle names?", "ts": "2026-07-16T22:50:48Z"}, {"note": "Providing my full name as it appears on the booking", "role": "customer", "text": "Ulrich Fenerwyn", "ts": "2026-07-16T22:50:54Z"}, {"note": "", "role": "assistant", "text": "Thanks, **Ulrich**! Could you please share your **booking reference number**? It's a 6-character code made up of letters and/or numbers, found in your booking confirmation email.", "ts": "2026-07-16T22:51:00Z"}, {"note": "Providing my booking reference/PNR", "role": "customer", "text": "BTQPIW", "ts": "2026-07-16T22:51:05Z"}, {"note": "", "role": "assistant", "text": "Just to confirm:\n\n- **First name:** Ulrich\n- **Last name:** Fenerwyn\n- **Booking reference:** BTQPIW\n\nIs that all correct?", "ts": "2026-07-16T22:51:11Z"}, {"note": "Confirming the booking details are correct", "role": "customer", "text": "Yes, that's correct", "ts": "2026-07-16T22:51:16Z"}, {"note": "", "role": "assistant", "text": "To keep your account secure and assist you further, I'll need to verify your identity. I'll send a one-time verification code to your email on file (l*****@a*****.com). Shall I go ahead?", "ts": "2026-07-16T22:51:29Z"}, {"note": "", "role": "assistant", "text": "\u00a7W\u00a7OPTIONS\u00a7Yes \u2022 No", "ts": "2026-07-16T22:51:29Z"}, {"note": "widget:QUICK_REPLIES->Yes", "role": "customer", "text": "Yes", "ts": "2026-07-16T22:51:34Z"}, {"note": "", "role": "assistant", "text": "I've sent a verification code to your email, please enter it within 15 minutes of receiving it. If you haven't received a code, please wait 1 minute before requesting a new one.", "ts": "2026-07-16T22:51:57Z"}, {"note": "otp", "role": "customer", "text": "463317", "ts": "2026-07-16T22:52:05Z"}, {"note": "", "role": "assistant", "text": "\u00a7W\u00a7BANNER\u00a7Your identity has been verified.", "ts": "2026-07-16T22:52:40Z"}, {"note": "", "role": "assistant", "text": "Can you confirm that this is the trip you're claiming for?", "ts": "2026-07-16T22:52:40Z"}, {"note": "", "role": "assistant", "text": "\u00a7W\u00a7FLIGHT\u00a7YYZ \u2192 LHR \u00b7 Thu, Jul 09 \u00b7 AC8002 \u00b7 08:00\u219211:00 \u00b7 nonstop", "ts": "2026-07-16T22:52:40Z"}, {"note": "", "role": "assistant", "text": "\u00a7W\u00a7OPTIONS\u00a7Yes \u2022 No", "ts": "2026-07-16T22:52:41Z"}, {"note": "widget:QUICK_REPLIES->Yes", "role": "customer", "text": "Yes", "ts": "2026-07-16T22:52:46Z"}, {"note": "", "role": "assistant", "text": "\u00a7W\u00a7OPTIONS\u00a7Canada \u2022 United States \u2022 Other", "ts": "2026-07-16T22:52:56Z"}, {"note": "widget:QUICK_REPLIES->Canada", "role": "customer", "text": "Canada", "ts": "2026-07-16T22:53:02Z"}, {"note": "", "role": "assistant", "text": "I'm sorry \u2014 I can't review this case automatically right now. Would you like me to submit it for one of our agents to review?", "ts": "2026-07-16T22:53:13Z"}, {"note": "", "role": "assistant", "text": "\u00a7W\u00a7OPTIONS\u00a7Yes, submit for review \u2022 No thanks", "ts": "2026-07-16T22:53:13Z"}, {"note": "Bot cannot process automatically and is handing off to agent - this is a final outcome (not eligible for automated processing)", "role": "customer", "text": "Yes, submit for review", "ts": "2026-07-16T22:53:19Z"}, {"note": "", "role": "assistant", "text": "\u00a7W\u00a7BANNER\u00a7Your case has been submitted for agent review.", "ts": "2026-07-16T22:53:28Z"}, {"note": "", "role": "assistant", "text": "An agent will follow up with you by email with the next steps.", "ts": "2026-07-16T22:53:28Z"}, {"note": "", "role": "assistant", "text": "Is there anything else I can help you with?", "ts": "2026-07-16T22:53:28Z"}], "verdict": {"amount": null, "checks": [{"actual": "ESCALATED", "expected": "NOT_ELIGIBLE", "name": "Decision Status", "pass": false}, {"actual": "none provided", "expected": "FD-APPR-NE-29", "name": "System Code", "pass": false}, {"actual": "none", "expected": "CAD 400.0", "name": "Compensation Amount", "pass": false}], "decision": "ESCALATED", "matches_expected": false, "reached_determination": false, "reasoning": "The expected outcome was an ELIGIBLE determination with system code FD-APPR-NE-29 and CAD 400.0 compensation. However, the chatbot failed to reach any eligibility determination. Instead, it stated \"I'm sorry \u2014 I can't review this case automatically right now\" and escalated the case to an agent for manual review. Since no automated decision was rendered, the bot did not reach the expected determination. This is a failure case where the bot should have processed the claim automatically but instead punted to human review."}}